title,filed_date,docket_numbers,category,libraries,accession_number,pdf_files,affiliations
Pacific Gas and Electric Company submits 2024 Emergency Action Plan Annual Update re the Blue Lake Dam et al. of the Drum-Spaulding Hydroelectric Project under P-2310.,12/26/2024,['P-2310-000'],Submittal,['Hydro'],,"[{'file_name': 'PGE20241223_2310_2024_EAP_Annual_Update_2310D_Drum_Enc1.pdf', 'file_desc': ""PG&E's Ltr Re: Drum-Spaulding 2024 Emergency Action Plan Annual Update - Enc 1"", 'file_size': 12244987, 'download_url': 'https://elibrary.ferc.gov/eLibrary/filedownload?fileid=662EA734-F286-CEAD-BB96-94032DB00000'}, {'file_name': 'PGE20241223_2310_2024_EAP_Annual_Update_2310D_Drum_Enc2.pdf', 'file_desc': ""PG&E's Ltr Re: Drum-Spaulding 2024 Emergency Action Plan Annual Update - Enc 2"", 'file_size': 39650610, 'download_url': 'https://elibrary.ferc.gov/eLibrary/filedownload?fileid=B8FF2F52-B749-C4BB-8274-94032DB00001'}, {'file_name': 'PGE20241223_2310_2024_EAP_Annual_Update_2310D_Drum_Enc3.pdf', 'file_desc': ""PG&E's Ltr Re: Drum-Spaulding 2024 Emergency Action Plan Annual Update - Enc 3"", 'file_size': 38627071, 'download_url': 'https://elibrary.ferc.gov/eLibrary/filedownload?fileid=8FF4970C-16B2-C64F-88DD-94032DC00000'}, {'file_name': 'PGE20241223_2310_2024_EAP_Annual_Update_2310D_Drum_Enc4.pdf', 'file_desc': ""PG&E's Ltr Re: Drum-Spaulding 2024 Emergency Action Plan Annual Update - Enc 4"", 'file_size': 28391335, 'download_url': 'https://elibrary.ferc.gov/eLibrary/filedownload?fileid=5D3F0D40-0A69-C366-90B9-94032DC00000'}, {'file_name': 'PGE20241223_2310_2024_EAP_Annual_Update_2310D_Drum_Enc5.pdf', 'file_desc': ""PG&E's Ltr Re: Drum-Spaulding 2024 Emergency Action Plan Annual Update - Enc 5"", 'file_size': 26376131, 'download_url': 'https://elibrary.ferc.gov/eLibrary/filedownload?fileid=76CAF5D8-7B47-C66F-86E7-94032DD00000'}, {'file_name': 'PGE20241223_2310_2024_EAP_Annual_Update_2310D_Drum_Enc6.pdf', 'file_desc': ""PG&E's Ltr Re: Drum-Spaulding 2024 Emergency Action Plan Annual Update - Enc 6"", 'file_size': 17226243, 'download_url': 'https://elibrary.ferc.gov/eLibrary/filedownload?fileid=4BB9C9A7-D708-CC49-8C4A-94032DD00000'}, {'file_name': 'PGE20241223_2310_2024_EAP_Annual_Update_2310D_Drum_Enc7.pdf', 'file_desc': ""PG&E's Ltr Re: Drum-Spaulding 2024 Emergency Action Plan Annual Update - Enc 7"", 'file_size': 36626325, 'download_url': 'https://elibrary.ferc.gov/eLibrary/filedownload?fileid=CA48D469-8F88-C38E-9690-94032DD00000'}, {'file_name': 'PGE20241223_2310_2024_EAP_Annual_Update_2310D_Drum_Enc8.pdf', 'file_desc': ""PG&E's Ltr Re: Drum-Spaulding 2024 Emergency Action Plan Annual Update - Enc 8"", 'file_size': 26384806, 'download_url': 'https://elibrary.ferc.gov/eLibrary/filedownload?fileid=EE41F7D4-3DC4-C60D-9C55-94032DD00000'}, {'file_name': 'PGE20241223_2310_2024_EAP_Annual_Update_2310D_Drum_Enc9.pdf', 'file_desc': ""PG&E's Ltr Re: Drum-Spaulding 2024 Emergency Action Plan Annual Update - Enc 9"", 'file_size': 26018856, 'download_url': 'https://elibrary.ferc.gov/eLibrary/filedownload?fileid=E2EB9BA3-18F4-C67D-8A15-94032DE00000'}, {'file_name': 'PGE20241223_2310_2024_EAP_Annual_Update_2310D_Drum_Enc10.pdf', 'file_desc': ""PG&E's Ltr Re: Drum-Spaulding 2024 Emergency Action Plan Annual Update - Enc 10"", 'file_size': 17649638, 'download_url': 'https://elibrary.ferc.gov/eLibrary/filedownload?fileid=1F65001D-2E59-C8BF-9104-94032DE00000'}, {'file_name': 'PGE20241223_2310_2024_EAP_Annual_Update_2310D_Drum_Enc11.pdf', 'file_desc': ""PG&E's Ltr Re: Drum-Spaulding 2024 Emergency Action Plan Annual Update - Enc 11"", 'file_size': 39470349, 'download_url': 'https://elibrary.ferc.gov/eLibrary/filedownload?fileid=3D21168F-AAB0-CE31-9AC7-94032DE00000'}, {'file_name': 'PGE20241223_2310_2024_EAP_Annual_Update_2310D_Drum_Enc12.pdf', 'file_desc': ""PG&E's Ltr Re: Drum-Spaulding 2024 Emergency Action Plan Annual Update - Enc 12"", 'file_size': 35106207, 'download_url': 'https://elibrary.ferc.gov/eLibrary/filedownload?fileid=400890A0-111D-C8D2-8A1B-94032DF00000'}, {'file_name': 'PGE20241223_2310_2024_EAP_Annual_Update_2310D_Drum_Enc13.pdf', 'file_desc': ""PG&E's Ltr Re: Drum-Spaulding 2024 Emergency Action Plan Annual Update - Enc 13"", 'file_size': 37006311, 'download_url': 'https://elibrary.ferc.gov/eLibrary/filedownload?fileid=47A3F536-549C-C7D8-92D2-94032DF00000'}, {'file_name': 'PGE20241223_2310_2024_EAP_Annual_Update_2310D_Drum_Enc14.pdf', 'file_desc': ""PG&E's Ltr Re: Drum-Spaulding 2024 Emergency Action Plan Annual Update - Enc 14"", 'file_size': 29014911, 'download_url': 'https://elibrary.ferc.gov/eLibrary/filedownload?fileid=8DEB28AF-9C30-C751-9ACB-94032DF00000'}, {'file_name': 'PGE20241223_2310_2024_EAP_Annual_Update_2310D_Drum_Enc15.pdf', 'file_desc': ""PG&E's Ltr Re: Drum-Spaulding 2024 Emergency Action Plan Annual Update - Enc 15"", 'file_size': 1660497, 'download_url': 'https://elibrary.ferc.gov/eLibrary/filedownload?fileid=18826A76-2FFB-CFF9-8B71-94032E000000'}]","['AUTHOR: Pacific Gas and Electric Company', 'RECIPIENT: Office of the Secretary, FERC']"
"Stone Ridge Hydro, LLC submits request to use the Traditional Licensing Process for the relicensing of the Herkimer Hydroelectric Project et. al. under P-15359 et. al.",10/31/2024,"['P-9709-071', 'P-15359-000']",Submittal,['Hydro'],,"[{'file_name': 'P-15359_Requests_for_TLP_and_Waivers.pdf', 'file_desc': 'No description given', 'file_size': 663156, 'download_url': 'https://elibrary.ferc.gov/eLibrary/filedownload?fileid=A5B23554-48F9-C080-91F8-92E2F2C00000'}]","['RECIPIENT: Office of the Secretary, FERC', 'AUTHOR: Stone Ridge Hydro, LLC', 'AGENT: Hydro Power, Inc.']"
"The City of Hamilton, Ohio submits Eighth Part 12D Periodic Inspection Report and plan and schedule to address Independent Consultant Team recommendations re the Greenup Hydroelectric Project under P-2614.",10/29/2024,['P-2614-000'],Submittal,['Hydro'],,"[{'file_name': 'PIR_Greenup for FERC 2024 Part 12D_2024.10.18_Final.pdf', 'file_desc': 'Greenup 8th FERC Part 12D Report for a Periodic Inspection - Periodic Inspection Report Submission', 'file_size': 39887508, 'download_url': 'https://elibrary.ferc.gov/eLibrary/filedownload?fileid=A20CA259-05E3-C6B4-A3B5-92D93B600000'}]","['RECIPIENT: Office of the Secretary, FERC', 'AUTHOR: HAMILTON, CITY OF (OH)']"
"Columbia Gas Transmission, LLC submits Prior Notice Request to abandon 5 injection/withdrawal wells, connecting pipelines, and appurtenant facilities located at the Lorain, Lucas, Pavonia, and Weaver Storage Fields in Central Ohio under CP25-36.",12/17/2024,['CP25-36-000'],Submittal,['Gas'],,"[{'file_name': 'PRIV_Vol 2 Lorain, Lucas, Pavonia, Weaver Well Abandonemnt BPN_Final.pdf', 'file_desc': 'Privileged Volume 2 Lorain, Lucas, Pavonia, Weaver BPN_ER_Final', 'file_size': 33650185, 'download_url': 'https://elibrary.ferc.gov/eLibrary/filedownload?fileid=F19D3BFF-DFBD-CB75-A028-93D663100000'}]","['AUTHOR: Columbia Gas Transmission, LLC', 'AGENT: TC Energy Corporation', 'RECIPIENT: Office of the Secretary, FERC']"
"Columbia Gas Transmission, LLC submits Prior Notice Request to abandon 5 injection/withdrawal wells, connecting pipelines, and appurtenant facilities located at the Lorain, Lucas, Pavonia, and Weaver Storage Fields in Central Ohio under CP25-36.",12/17/2024,['CP25-36-000'],Submittal,['Gas'],,"[{'file_name': 'CEII_Vol 3 Lorain, Lucas, Pavonia, Weaver Well Abandonment Project.pdf', 'file_desc': 'CEII Volume 3 Lorain, Lucas, Pavonia, Weaver BPN_ER_Final', 'file_size': 148696336, 'download_url': 'https://elibrary.ferc.gov/eLibrary/filedownload?fileid=B3B8EFEA-7BEA-CB5E-A3BB-93D663200000'}]","['RECIPIENT: Office of the Secretary, FERC', 'AUTHOR: Columbia Gas Transmission, LLC', 'AGENT: TC Energy Corporation']"
"Columbia Gas Transmission, LLC submits Application for a Certificate of Public Convenience and Necessity to drill one new injection/withdrawal well, et al. re the Donegal New Drill 12653 Project under CP25-35.",12/17/2024,['CP25-35-000'],Submittal,['Gas'],,"[{'file_name': 'PUB CP25-XX Donegal 12653 New Drill- Application.pdf', 'file_desc': 'No description given', 'file_size': 4654520, 'download_url': 'https://elibrary.ferc.gov/eLibrary/filedownload?fileid=D5350C94-79E7-CDEE-9A53-93D650A00000'}, {'file_name': 'PUB CP25-XX Donegal New Drill- ER.pdf', 'file_desc': 'No description given', 'file_size': 69196041, 'download_url': 'https://elibrary.ferc.gov/eLibrary/filedownload?fileid=633B0A8F-C74E-CDEF-A186-93D650A00000'}]","['RECIPIENT: Office of the Secretary, FERC', 'AGENT: TC Energy Corporation', 'AUTHOR: Columbia Gas Transmission, LLC']"
