title,filed_date,docket_numbers,category,libraries,accession_number,pdf_files,affiliations
Post-Workshop Comments of the Solar Energy Industries Association under AD24-11.,12/09/2024,['AD24-11-000'],Submittal,['RulemakingElectric'],,"[{'file_name': 'AD24-11 Co-Location -  Final 12.9.24.pdf', 'file_desc': 'SEIA Comments\n', 'file_size': 193395, 'download_url': 'https://elibrary.ferc.gov/eLibrary/filedownload?fileid=D9637D12-9FCF-C996-9F4F-93AD0AF00000'}]","['AUTHOR: Solar Energy Industries Association', 'RECIPIENT: Office of the Secretary, FERC']"
"Post-Technical Conference Comments of Vincent Duane Princial, Copper Monarch LLC. under AD24-11.",12/09/2024,['AD24-11-000'],Submittal,['RulemakingElectric'],,"[{'file_name': 'AD24-11-000 - V Duane Post Conference Comments.pdf', 'file_desc': 'Post-Technical Conference Comments of Vincent Duane', 'file_size': 172536, 'download_url': 'https://elibrary.ferc.gov/eLibrary/filedownload?fileid=FDAECAFB-E7A4-CFD3-9811-93ACE0500000'}]","['AUTHOR: Duane, Vincent', 'RECIPIENT: Office of the Secretary, FERC', 'AGENT: Wilkinson Barker Knauer, LLP']"
"Post-Technical Conference Comments of the New York State Reliability Council, L.L.C. under AD24-11.",12/09/2024,['AD24-11-000'],Submittal,['RulemakingElectric'],,"[{'file_name': 'AD24-11-000 - NYSRC Comments 12-9-2024.pdf', 'file_desc': 'No description given', 'file_size': 843246, 'download_url': 'https://elibrary.ferc.gov/eLibrary/filedownload?fileid=15D40C5B-5965-C6AF-935F-93ACC3100000'}]","['AUTHOR: New York State Reliability Council, L.L.C.', 'AGENT: Couch White, LLP', 'RECIPIENT: Office of the Secretary, FERC']"
"Post Technical Conference Comments of Organization of PJM States, Inc. under AD24-11.",12/09/2024,['AD24-11-000'],Submittal,['RulemakingElectric'],,"[{'file_name': 'OPSI Comments AD24-11 (final).pdf', 'file_desc': 'Comments of Organization of PJM States Inc.', 'file_size': 206813, 'download_url': 'https://elibrary.ferc.gov/eLibrary/filedownload?fileid=1321A226-185F-C6DE-9D17-93AC63100000'}]","['AUTHOR: Organization of PJM States, Inc.', 'RECIPIENT: Office of the Secretary, FERC']"
Comments of Digital Energy Council re the Large Loads Co-Located at Generating Facilities under AD24-11.,12/09/2024,['AD24-11-000'],Submittal,['RulemakingElectric'],,"[{'file_name': 'FERC Response.pdf', 'file_desc': 'No description given', 'file_size': 194167, 'download_url': 'https://elibrary.ferc.gov/eLibrary/filedownload?fileid=B04AA091-797A-C3FE-9D44-93AC53C00000'}]","['AUTHOR: Digital Energy Council', 'RECIPIENT: Office of the Secretary, FERC']"
"Statement of Stacey Burbure, American Electric Power, from the Technical Conference Regarding Large Loads Co-Located at Generating Facilities, 11/01/2024 under Docket Number AD24-11-000. ",11/04/2024,['AD24-11-000'],Submittal,['ElectricRulemaking'],,"[{'file_name': 'Statement of Stacey Burbure_AEP_Panel 1.pdf', 'file_desc': '', 'file_size': 157116, 'download_url': 'https://elibrary.ferc.gov/eLibrary/filedownload?fileid=EF33F146-0EE8-CC90-993A-92F79CE00000'}]","['AUTHOR: AMERICAN ELECTRIC POWER SERVICE CORPORATION', 'RECIPIENT: FEDERAL ENERGY REGULATORY COMMISSION']"
"Statement of Howard Gugel, North American Electric Reliability Corporation, from the Technical Conference Regarding Large Loads Co-Located at Generating Facilities, 11/01/2024 under Docket Number AD24-11-000.",11/04/2024,['AD24-11-000'],Submittal,['ElectricRulemaking'],,"[{'file_name': 'NERC Large Load Comments.pdf', 'file_desc': '', 'file_size': 70787, 'download_url': 'https://elibrary.ferc.gov/eLibrary/filedownload?fileid=73639E63-98BC-CC5D-99B8-92F7BD600000'}]","['AUTHOR: NORTH AMERICAN RELIABILITY CORPORATION', 'RECIPIENT: FEDERAL ENERGY REGULATORY COMMISSION']"
